{
  "$schema": "https://json-schema.org/draft/2020-12/schema",
  "$id": "https://macro-regime.local/schemas/e14-external-authority-provisioning-remediation-v2.json",
  "type": "object", "additionalProperties": false,
  "required": ["schemaVersion", "artifactType", "phaseId", "blockedReviewSha256", "protocolBindings", "scope", "evidenceRequirements", "remediationChecks", "gates", "nextAllowedAction"],
  "properties": {
    "schemaVersion": {"const": 2}, "artifactType": {"const": "E14ExternalAuthorityProvisioningRemediation"}, "phaseId": {"const": "E14.8b"},
    "blockedReviewSha256": {"const": "7b5a1a00b2e795fbb7a4d0e1789f42f8bcfd59a7e2938b5f431bcea2f2bbd177"},
    "protocolBindings": {"const": {"operationalProtocolSchemaSha256":"6f242315e4e9e14d0b1f1a5df1960b3388e41f34db71137e7ac77547d0158688","operationalProtocolSha256":"1f6d9e3d1cad54a99db75c17d0c251c1dd22a42ef27ce9134746db977e6e06f6"}},
    "scope": {"const": {"designOnly":true,"providerSelected":false,"remoteResourcesCreated":false,"credentialsCreated":false,"runtimeCodeChanged":false,"networkRequestsMade":0}},
    "evidenceRequirements": {"const": {"providerIdentity":true,"endpointIdentity":true,"certificateOrKeyFingerprints":true,"tenantAndDeploymentBinding":true,"accessPolicy":true,"retentionAndRollbackPolicy":true,"failureInjectionReport":true,"operationsOwner":true,"incidentRunbook":true,"deprovisioningPlan":true}},
    "remediationChecks": {"const": {"allTenEvidenceClassesIndividuallyMandatory":true,"operationalStateMachineFrozen":true,"casAndIdempotencySemanticsFrozen":true,"identityErrorRetryAndRecoveryFrozen":true,"durabilityAndLocalSafetyFrozen":true,"mandatoryConformanceMatrixFrozen":true}},
    "gates": {"const": {"independentRemediationReviewAuthorized":true,"providerSelectionAuthorized":false,"externalProvisioningAuthorized":false,"providerNetworkAuthorized":false,"credentialCreationAuthorized":false,"adapterImplementationAuthorized":false,"productionPublicationAuthorized":false,"downstreamAuthorized":false}},
    "nextAllowedAction": {"const": "E14.8c independent review of the E14.8b remediation; provider selection, provisioning, network, credentials, adapter implementation, publication and downstream remain closed."}
  }
}
